{
  "schema_version": "0.1",
  "identity": {
    "project_alias": "demo-app",
    "target_environment": "trial target",
    "provider_profile": "local",
    "mode": "basic",
    "updated_at": "2026-10-06T00:27:12Z",
    "updated_by": {
      "role": "ai",
      "name": "ai-deployer"
    },
    "session_id": "session-a"
  },
  "stage": "plan",
  "activity": {
    "summary": "Continuing the plan with the reduced skill package (gap already disclosed)",
    "started_at": "2026-10-06T00:25:12Z",
    "expected_duration": null,
    "slow_reason": null,
    "waiting_on": "ai",
    "last_progress": {
      "at": "2026-10-06T00:27:12Z",
      "summary": "Plan tiers drafted"
    }
  },
  "brief": {
    "app_summary": "demo-app: an API and a web front end",
    "components": [
      {
        "name": "api",
        "role": "HTTP API"
      },
      {
        "name": "web",
        "role": "Front end"
      }
    ],
    "topology": "Two containers on this machine",
    "resource_rationale": "One machine is enough for a single tester",
    "heavier_alternatives": [
      {
        "alternative": "An orchestration cluster",
        "why_unnecessary": "Two containers need no scheduler"
      }
    ],
    "assumptions": []
  },
  "plan": {
    "tiers": [
      {
        "id": "local",
        "name": "Local containers",
        "composition": "api and web containers",
        "region": "this machine",
        "cost_range": {
          "low": 0,
          "high": 0,
          "currency": "USD",
          "period": "month"
        },
        "price_checked_at": null,
        "load_assumption": "One tester",
        "uncertainty": "Runs on this machine at no cloud cost"
      }
    ],
    "default_tier": "local",
    "selected_tier": null
  },
  "pending_decision": null,
  "resources": [],
  "sources": [],
  "facts": [],
  "secrets": [],
  "open_items": [
    {
      "text": "Package gap (declared in skills/package-omissions.json): providers/dns-cloudflare.md is not in this package. Impact: no provider-specific DNS steps; follow the generic loop and the DNS provider's official documentation; any DNS change still needs its own approval.",
      "owner": "ai",
      "blocking": false
    }
  ],
  "next": {
    "action": "Finish the plan with the generic rules; the DNS record request will be a separate dns approval",
    "decision_owner": "ai"
  },
  "handoff": {
    "read_first": [
      "skills/router.md",
      "state.json",
      "events.jsonl (recent events only)"
    ],
    "last_safe_state": null,
    "rollback_anchor": null,
    "known_unverified": [],
    "fragile": []
  }
}
